id	year	authors	title	publication	group	doi	citations	impact	learning_categories	models_implemented	key_words	abstract
16	2020	Amir Farzad;T. Aaron Gulliver	Unsupervised log message anomaly detection	ICT Express	Experimental	10.1016/j.icte.2020.06.003	34	17	unsupervised	isolation forest;autoencoder networks	anomaly detection;classification;deep learning;log messages;unsupervised learning	Log messages are now broadly used in cloud and software systems. They are important for classification and anomaly detection as millions of logs are generated each day. In this paper, an unsupervised model for log message anomaly detection is proposed which employs Isolation Forest and two deep Autoencoder networks. The Autoencoder networks are used for training and feature extraction, and then for anomaly detection, while Isolation Forest is used for positive sample prediction. The proposed model is evaluated using the BGL, Openstack and Thunderbird log message data sets. The results obtained show that the number of negative samples predicted to be positive is low, especially with Isolation Forest and one Autoencoder. Further, the results are better than with other well-known models.
17	2021	Zhijun Zhao;Chen Xu;Bo Li	A LSTM-Based Anomaly Detection Model for Log Analysis	Journal of Signal Processing Systems	Experimental	10.1007/s11265-021-01644-4	5	5	unsupervised	long short-term memory	anomaly detection;log analysis	Security devices produce huge number of logs which are far beyond the processing speed of human beings. This paper introduces an unsupervised approach to detecting anomalous behavior in large scale security logs. We propose a novel feature extracting mechanism and could precisely characterize the features of malicious behaviors. We design a LSTM-based anomaly detection approach and could successfully identify attacks on two widely-used datasets. Our approach outperforms three popular anomaly detection algorithms, one-class SVM, GMM and Principal Components Analysis, in terms of accuracy and efficiency.
18	2021	Shilin He;Pinjia He;Zhuangbin Chen;Tianyi Yang;Yuxing Su;Michael R. Lyu	A Survey on Automated Log Analysis for Reliability engineering	ACM Computing Surveys	Survey	10.1145/3460345	34	34	NA	NA	NA	NA
19	2021	Xiaoyu Duan;Shi Ying;Wanli Yuan;Hailong Cheng;Xiang Yin	QLLog: A log anomaly detection method based on Q-learning algorithm	Information Processing & Management	Experimental	10.1016/j.ipm.2021.102540	7	7	reinforcement	q-learning	log anomaly detection;q-learning;reinforcement learning;data analysis	Most of the existing log anomaly detection methods suffer from scalability and numerous false positives. Besides, they cannot rank the severity level of abnormal events. This paper proposes a log anomaly detection based on Q-learning, namely QLLog, which can detect multiple types of system anomalies and rank the severity level of abnormal events. We first build a mathematical model of log anomaly detection, proving that log anomaly detection is a sequential decision problem. Second, we use the Q-learning algorithm to build the core of the anomaly detection model. This allows QLLog to automatically learn directed acyclic graph log patterns from normal execution and adjust the training model according to the reward value. Then, QLLog combines the advantages of the Q-learning algorithm and the specially designed rules to detect anomalies when log patterns deviate from the model trained from log data under normal execution. Besides, we provide a feedback mechanism and build an abnormal level table. Therefore, QLLog can adapt to new log states and log patterns. Experiments on real datasets show that the method can quickly and effectively detect system anomalies. Compared with the state of the art, QLLog can detect numerous real problems with high accuracy 95%, and its scalability outperforms other existing log-based anomaly detection methods.
20	2021	Lin Yang;Junjie Chen;Zan Wang;Weijing Wang;Jiajun Jiang;Xuayuan Dong;Wenbing Zhang	Semi-Supervised Log-Based Anomaly Detection via Probabilistic Label Estimation	IEEE/ACM 43rd International Conference on Software Engineering	Experimental	10.1109/ICSE43902.2021.00130	24	24	semi-supervised	probabilistic label estimation;gated recurrent unit	log analysis;anomaly detection;deep learning;probabilistic estimation;label	With the growth of software systems, logs have become an important data to aid system maintenance. Log-based anomaly detection is one of the most important methods for such purpose, which aims to automatically detect system anomalies via log analysis. However, existing log-based anomaly detection approaches still suffer from practical issues due to either depending on a large amount of manually labeled training data (supervised approaches) or unsatisfactory performance without learning the knowledge on historical anomalies (unsupervised and semi-supervised approaches). In this paper, we propose a novel practical log-based anomaly detection approach, PLELog, which is semi-supervised to get rid of time-consuming manual labeling and incorporates the knowledge on historical anomalies via probabilistic label estimation to bring supervised approaches’ superiority into play. In addition, PLELog is able to stay immune to unstable log data via semantic embedding and detect anomalies efficiently and effectively by designing an attention-based GRU neural network. We evaluated PLELog on two most widely-used public datasets, and the results demonstrate the effectiveness of PLELog, significantly outperforming the compared approaches with an average of 181.6% improvement in terms of Fl-score. In particular, PLELog has been applied to two real-world systems from our university and a large corporation, further demonstrating its practicability.
